{
  "schemaVersion": "0.1.0",
  "tool": { "name": "coverdict", "version": "0.1.0" },
  "analysis": { "status": "complete", "exitCode": 0, "incompleteReasons": [] },
  "inputs": {
    "diffMode": "base-ref",
    "baseRef": "origin/main",
    "resolved": {
      "base": "a1b2c3d4e5f60718293a4b5c6d7e8f9012345678",
      "mergeBase": "a1b2c3d4e5f60718293a4b5c6d7e8f9012345678",
      "head": "0f1e2d3c4b5a69788796a5b4c3d2e1f001234567",
      "dirty": true
    },
    "languageLevel": 17,
    "encoding": "UTF-8",
    "exclusions": ["**/generated/**"],
    "modules": [
      {
        "id": "core",
        "root": ".",
        "sourceRoots": ["src/main/java"],
        "testRoots": ["src/test/java"],
        "reports": [
          { "path": "target/site/jacoco/jacoco.xml", "freshness": "unverified" }
        ]
      }
    ]
  },
  "coverage": {
    "overall": {
      "jacoco-line": { "numeratorName": "coveredLines", "numerator": 56, "denominatorName": "executableLines", "denominator": 71, "percent": 78.9 },
      "strict-line": { "numeratorName": "fullyCoveredLines", "numerator": 48, "denominatorName": "executableLines", "denominator": 71, "percent": 67.6 },
      "sonar-compatible": { "numeratorName": "coveredBranchesPlusCoveredLines", "numerator": 91, "denominatorName": "branchesPlusExecutableLines", "denominator": 125, "percent": 72.8 }
    },
    "newCode": {
      "jacoco-line": { "numeratorName": "coveredLines", "numerator": 10, "denominatorName": "executableLines", "denominator": 14, "percent": 71.4 },
      "strict-line": { "numeratorName": "fullyCoveredLines", "numerator": 8, "denominatorName": "executableLines", "denominator": 14, "percent": 57.1 },
      "sonar-compatible": { "numeratorName": "coveredBranchesPlusCoveredLines", "numerator": 12, "denominatorName": "branchesPlusExecutableLines", "denominator": 18, "percent": 66.7 }
    }
  },
  "changedFiles": [
    {
      "path": "src/main/java/com/demo/core/IbanValidator.java",
      "module": "core",
      "classification": "mapped",
      "newLines": 14,
      "coveredNewLines": 10,
      "uncoveredNewRanges": [[42, 44], [51, 51]]
    },
    {
      "path": "src/main/java/com/demo/core/package-info.java",
      "module": "core",
      "classification": "non-executable"
    }
  ],
  "findings": [
    {
      "rule": "NO_RECOGNIZED_ORACLE",
      "severity": "WARNING",
      "confidence": "HIGH",
      "module": "core",
      "path": "src/test/java/com/demo/core/IbanValidatorTest.java",
      "startLine": 25,
      "endLine": 31,
      "testMethod": "com.demo.core.IbanValidatorTest#printsResultOnly()",
      "message": "Test executes IbanValidator.validate but contains no recognized assertion, verification, or expected exception.",
      "suggestedAction": "Add an assertion on the validate result, or register the helper it calls as a custom oracle in configuration.",
      "fingerprint": "3f9a1c2b4d5e6a70"
    },
    {
      "rule": "NULL_CHECK_ONLY",
      "severity": "INFO",
      "confidence": "MEDIUM",
      "module": "core",
      "path": "src/test/java/com/demo/core/IbanValidatorTest.java",
      "startLine": 40,
      "endLine": 45,
      "testMethod": "com.demo.core.IbanValidatorTest#returnsSomething()",
      "message": "The only oracle is assertNotNull on the returned value; content is never verified.",
      "suggestedAction": "Consider asserting on the value's content; advisory only.",
      "fingerprint": "8b0c7d6e5f4a3921"
    }
  ],
  "warnings": [
    {
      "code": "UNTRACKED_NON_JAVA_FILE",
      "message": "Untracked file ignored by diff analysis.",
      "path": "notes.txt"
    }
  ]
}
